PID,Gist_Hindi_by_Sant_Singh
P0046L21,मानव को यदि पूर्ण सतिगुरु मिल जाए तो उसे नाम रूपी खजाना मिल जाता है।
P0046L22,हे प्रभु ! तुम मुझ पर अपनी ऐसी कृपा करो कि मैं तुम्हारे नामामृत का जाप करूँ।
P0046L23,मेरे जन्म-मरण का दुख दूर हो जाए तो मेरा सहजावस्था में ध्यान लग जाए॥१॥
P0046L24,हे मेरे मन ! तुम प्रभु की शरण प्राप्त करो।
P0046L25,"उस एक परमात्मा के नाम का ध्यान करो, क्योंकि उस हरि के बिना अन्य कोई नहीं है ॥१॥ रहाउ ॥"
P0046L26,उस परमेश्वर का मूल्यांकन कदापि नहीं किया जा सकता। क्योंकि वह परमात्मा अथाह गुणों का सागर है।
P0046L27,सौभाग्य के कारण तुम सत्संग में मिल जाओ तथा वहाँ से श्रद्धा रूपी मूल्य देकर गुरु से सत्य उपदेश खरीद लो।
P0046L28,"उस सुखों के सागर की सेवा कर अर्थात् श्रद्धा सहित उस परमात्मा की आराधना कर, वह राजाओं का भी महाराजा सबसे बड़ा मालिक है॥ २॥"
P0046L29,हमें प्रभु के चरण कवलों का सहारा है क्योंकि उसके अतिरिक्त अन्य कोई ठिकाना नहीं।
P0046L30,हे परमेश्वर ! तुम्हारी शक्ति से ही मेरा अस्तित्व है। मुझे आपका ही आश्रय है और आपके सत्य द्वारा ही मैं जीवित हूँ।
P0046L31,"हे प्रभु ! सम्मानहीनों का ही तू सम्मान है जिन पर तुम्हारी कृपा हुई है, वह तुझ में ही विलीन हुए हैं।॥३॥"
P0046L32,"गोविन्द को आठों प्रहर जपते रहना चाहिए, उसकी आराधना करनी चाहिए।"
P0046L33,"भगवान अपनी कृपा करके जीवों के प्राणों, तन, धन की विषय-विकारों से रक्षा करता है।"
P0046L34,"हे नानक ! परमात्मा ने मेरे समस्त पाप दूर कर दिए हैं, चूकि वह पारब्रह्म क्षमाशील है॥ ४॥ १२॥ ६२॥"
P0046L35,श्रीरागु महला ५ ॥
P0046L36,"भक्तों की उस परमसत्य परमात्मा से प्रीति लगी है, जो न कभी जन्म लेता है और न ही मरता है।"
P0046L37,जुदा किए भी वह जुदा नहीं होता क्योंकि वह परमात्मा कण-कण में विद्यमान है।
P0046L38,वह प्रभुअनाथों के दुःख-दर्द नाश करता है और अपने भक्तों को आदर-सहित मिलता है।
P0046L39,हे मेरी माता ! वह माया रहित प्रभु आश्चर्यजनक स्वरूप वाला है तथा गुरु ने आकर मुझे उससे मिला दिया है॥१॥
P0046L40,हे भाई ! उस परमेश्वर को अपना मित्र बना।
P0047L01,मोह-माया की प्रीति को धिक्कार है। इससे कोई भी सुखी दिखाई नहीं देता ॥१॥ रहाउ॥
P0047L02,"वह परमेश्वर सर्वज्ञ, महान दाता, शीलवान, पवित्र, सुन्दर तथा बेअंत है।"
P0047L03,"वह प्राणी का साथी, सहायक, महान्, अनंत, विशाल एवं सर्वोच्च है।"
P0047L04,"परमात्मा को न बालक अथवा न ही वृद्ध समझना चाहिए, उस परमात्मा का दरबार सदैव स्थिर है।"
P0047L05,"हम जो कुछ भी परमात्मा के समक्ष श्रद्धापूर्वक याचना करते हैं, वह उससे प्राप्त कर लेते हैं। सर्वगुण सम्पन्न परमात्मा आश्रयहीनों का आश्रय है॥२॥"
P0047L06,"जिस प्रभु के दर्शन-मात्र से समस्त पाप दूर हो जाते हैं, मन एवं देह शीतल हो जाते हैं"
P0047L07,"तथा मन की समस्त भ्रांतियाँ मिट जाती हैं, उस प्रभु को एकाग्रचित होकर स्मरण करना चाहिए।"
P0047L08,"वह परमेश्वर गुणों का भण्डार है, वह सदैव निरोग एवं दानशील है। उसकी अनुकंपा अपरम्पार है।"
P0047L09,"दिन एवं रात उसे कभी भी विस्मृत मत करो, सदैव उस पारब्रह्म की आराधना करते रहनी चाहिए ॥ ३॥"
P0047L10,"जिसके माथे पर पूर्व से ही शुभ कर्मो का भाग्य लिखा है, गोविन्द उसका घनिष्ठ बना है।"
P0047L11,"उसे मैं अपना तन, मन, धन सब कुछ समर्पित करता हूँ और यह जीवन भी उस परमेश्वर पर न्योछावर करता हूँ।"
P0047L12,सर्वव्यापक परमात्मा नित्य ही जीवों को अपने समक्ष देखता एवं सुनता है। वह घट-घट प्रत्येक हृदय में व्याप्त है।
P0047L13,परमात्मा इतना दयालु-कृपालु है कि वह कृतघ्नों का भी पालन-पोषण करता है। हे नानक ! वह परमात्मा सदैव क्षमाशील है ॥४ ॥१३ ॥८३ ॥
P0047L14,श्रीरागु महला ५ ॥
P0047L15,"जिस प्रभु ने यह मन, तन व धन इत्यादि सब कुछ दिया है तथा इनको सजा संवार कर रखा हुआ है।"
P0047L16,उस प्रभु ने सर्वकला सम्पूर्ण शक्तियों द्वारा शरीर की रचना की है और अन्तर्मन में अपनी ज्योति प्रकट की है।
P0047L17,उस प्रभु की सदा आराधना करनी चाहिए तथा हृदय में बसाकर रखें॥१॥
P0047L18,हे मेरे मन ! ईश्वर के बिना अन्य कोई समर्थ नहीं।
P0047L19,सदैव उस प्रभु की शरण में रहने से तुझे कोई विपत्ति नहीं आएगी॥ १॥ रहाउ ॥
P0047L20,"स्वर्ण, चांदी, माणिक्य, हीरे-मोती रत्न पदार्थ समस्त मिट्टी समान हैं।"
P0047L21,"माता-पिता, सगे-संबंधी, रिश्तेदार समस्त झूठे रिश्तेदार हैं।"
P0047L22,"जिस प्रभु ने सब कुछ उत्पन्न किया है, उसे स्वेच्छाचारी एवं अपवित्र पशु समान जीव स्मरण नहीं करता॥२॥"
P0047L23,"परमेश्वर शरीर के अन्दर एवं बाहर परिपूर्ण है, वह कण-कण में व्याप्त है लेकिन उसे मनुष्य दूर समझता है।"
P0047L24,"जीव के अन्तर्मन में भोग विलास की तृष्णा है, वह विषय-विकारों में लिप्त है और उसका हृदय अहंकार एवं झूठ में भरा हुआ है।"
P0047L25,प्रभु की भक्ति एवं नाम-सिमरन से वंचित होने के कारण प्राणियों के समुदाय योनियों में फँसकर आते जाते रहते हैं। ३॥
P0047L26,हे करुणा निधान पारब्रह्म ! इन जीव-जन्तुओं पर कृपा-दृष्टि करके उनकी रक्षा करो।
P0047L27,यमराज बड़ा विकट हो गया है। प्रभु के बिना अन्य कोई रखवाला नहीं है।
P0047L28,नानक जी का कथन है कि हे प्रभु! अपनी कृपा करो तांकि मैं कभी भी तेरा नाम न भूलूं ॥४॥१४॥८४ ॥
P0047L29,श्रीरागु महला ५ ॥
P0047L30,"मनुष्य गर्व से कहता है कि यह तन-मन एवं धन मेरा है, इस देश पर शासन मेरा है।"
P0047L31,"मैं सुन्दर स्वरूप वाला हूँ तथा मेरे पुत्र हैं, स्त्री है, पुत्री है और अनेकानेक रंगों के भेष मैं ही धारण कर सकता हूँ।"
P0047L32,"हे भाई ! जिस मानव के हृदय में प्रभु नाम का निवास नहीं है, उसके समस्त किए काम गणना में नहीं आते ॥ १ II"
P0047L33,हे मेरे मन ! हरि-परमात्मा के नाम की आराधना करो
P0047L34,प्रतिदिन साधु-संतों की संगति में रहने का प्रयास करो और गुरु के चरणों में अपने चित्त को लगाओ ॥१॥ रहाउ॥
P0047L35,"हरि-नाम, जो सर्व प्रकार की निधि है, उसका चिन्तन तभी हो सकता है, यदि मनुष्य के माथे पर शुभ भाग्य अंकित हो।"
P0047L36,गुरु के चरणों में लगने से समस्त कार्य संवर जाते हैं।
P0047L37,इस प्रकार अहंकार के रोग एवं शंकाएँ निवृत्त हो जाती हैं और प्राणी का आवागमन कट जाता है और उसे मोक्ष की प्राप्ति होती है।॥२॥
P0047L38,"इसलिए हे जीव ! तू साधू की संगति कर, जो अठसठ तीथों के स्नान के समान अति पावन है।"
P0047L39,"नाम-सिमरन से तुम्हारी आत्मा, प्राण, मन एवं देहि प्रफुल्लित हो जाएँगे और यही जीवन का सत्य मनोरथ है।"
P0048L01,यहाँ पर तुझे मान-सम्मान प्राप्त होगा और प्रभु के दरबार में भी श्रेष्ठ स्थान प्राप्त होगा ॥३॥
P0048L02,"अकाल पुरुष स्वयं ही करने-करवाने वाला है। परमेश्वर सर्व-कर्ता है, सब कुछ उसके अधीन है।"
P0048L03,"वह सर्वव्यापक प्रभु कण-कण में विद्यमान है, जो स्वयं ही मारने वाला तथा जीवन दाता है। अन्दर तथा बाहर वह प्राणी का साथी है।"
P0048L04,"हे नानक ! प्रभु समस्त जीवों का स्वामी है, अत : मैं उसकी शरण में आया हूँ ॥४॥१५॥८५॥"
P0048L05,श्रीरागु महला ५ ॥
P0048L06,जब मेरा गुरु मुझ पर कृपालु हुआ तो मैं अपने प्रभु की शरण में आ गया।
P0048L07,सतिगुरु के उपदेश द्वारा मेरे समस्त बन्धन दूर हो गए हैं।
P0048L08,जब अन्तर्मन राम नाम के सिमरन में लीन हो गया तो मैं गुरु की कृपा से कृतार्थ हो गया।॥ १॥
P0048L09,हे मेरे मन ! सतिगुरु की सेवा श्रेष्ठ है।
P0048L10,"उस प्रभु को एक पल के लिए भी विस्मृत मत करना, तभी वह तुझ पर कृपा-दृष्टि करेगा ॥ रहाउ॥"
P0048L11,"हमें प्रतिदिन उस गोविन्द-प्रभु का यशगान करना चाहिए, जो मनुष्य के समस्त अवगुणों को निवृत्त करने वाला है।"
P0048L12,अनेक व्यक्तियों ने माया के प्रपंच करके देख लिए हैं किन्तु हरि-नाम के अलावा सुख नहीं मिलता।
P0048L13,"जो व्यक्ति भगवान की उपमा करने में मग्न रहते हैं, वे सहज ही भवसागर से पार हो जाते हैं ॥ २ ॥"
P0048L14,"लाखों तीर्थों के स्नान, लाखों व्रत रखने व इन्द्रियों को विषय-विकारों से रोकने का फल संतजनों की चरण-धूलि ग्रहण करने से ही प्राप्त हो जाता है।"
P0048L15,"हे भाई ! मानव किससे छिपकर पाप कमाता है, जबकि वह प्रभु सदैव समक्ष देख रहा है।"
P0048L16,मेरा परिपूर्ण परमेश्वर सर्वत्र व्याप्त हो रहा है ॥३॥
P0048L17,"सत्य परमेश्वर का साम्राज्य सत्य है, उसका आदेश भी सत्य है, उस सत्य परमेश्वर का स्थिर रहने वाला स्थान भी सत्य है।"
P0048L18,उसने सत्य शक्ति धारण की हुई है और उसने सत्य-सृष्टि की रचना की हुई है।
P0048L19,"हे नानक ! मैं उस पर कुर्बान जाता हूँ, जो सत्यस्वरूप परमात्मा का नाम-सिमरन करता है ॥ ४ ॥ १६ ॥ ८६ ॥"
P0048L20,श्रीरागु महला ५ ॥
P0048L21,हे भाग्यवान पुरुष ! परिश्रम करके हरि नाम सिमरन रूपी आत्म-धन एकत्र करो।
P0048L22,"सत्संग में जाकर हरि नाम का सिमरन किया जाता है, जिससे जन्म-जन्म के पापों की मैल कट जाती है। १॥"
P0048L23,हे मेरे मन ! राम-नाम रूपी जाप का सिमरन करो।
P0048L24,इससे तुझे मनोवांछित फल प्राप्त होंगे और तुम्हारे दुख तथा संताप सब नष्ट हो जाएँगे। ॥ रहाउ ॥
P0048L25,"जिस भगवान को पाने के लिए यह मानव-देह को धारण किया है, वह प्रभु अपने अंग-संग ही देख लिया है।"
P0048L26,"वह परिपूर्ण प्रभु जल में, धरती में, गगन में सर्वत्र व्यापक है, वह सब प्राणियों को दया की दृष्टि से देखता है ॥२॥"
P0048L27,सच्चे स्वामी प्रभु के साथ प्रीति लगाने से तन-मन सभी पवित्र हो जाते हैं।
P0048L28,"जो प्राणी प्रभु के चरणों का ध्यान करता है, मानो उसने समस्त जप-तप (उपासना-तपस्या) कर लिए हैं।॥३॥"
P0048L29,"अमृत रूपी हरि का नाम हीरे, जवाहररत्नों की भाँति अमूल्य है।"
P0048L30,"हे नानक ! जिसने प्रेम भाव से भगवान की महिमा का गायन किया है, उसे सहज ही अच्युत सुख के आनंद का रस प्राप्त हुआ है ॥४॥१७॥८७॥"
P0048L31,श्रीरागु महला ५ ॥
P0048L32,वह धार्मिक शास्त्र उचित है और वही शगुन शुभ है जिसके द्वारा हरि-नाम का सिमरन किया जाए।
P0048L33,जिस मानव जीव को गुरु ने चरण कमल रूप धन दिया है उस आश्रयहीन व्यक्ति को आश्रय मिल गया।
P0048L34,आठ पहर भगवान के गुणों का गायन करना ही सत्य राशि है तथा सत्य संयम है।
P0048L35,भगवान स्वयं जिनको कृपा करके मिला है वह जन्म-मरण के चक्कर से मुक्त हो जाता है।॥१॥
P0048L36,"हे मेरे मन ! तू सदैव एकाग्रचित होकर भगवान का भजन किया कर,"
P0048L37,चूंकि भगवान तो प्रत्येक हृदय के अन्दर समाया हुआ है तथा जीव के साथ होकर सहायता करता है॥१॥ रहाउ॥
P0048L38,जब प्रभु स्मरण किया तो इतने सुखों की उपलब्धि होती है कि उनकी गिनती नहीं हो सकती।
P0048L39,"जिसने भी हरि रस को चखा है, वह तृप्त हो गया तथा उस रस को वही आत्मा जानती है।"
P0049L01,संतों की संगति द्वारा क्षमावान प्रियतम प्रभु ह्रदय में बसता है।
P0049L02,जिसने अपने प्रभु नाम का सिमरन किया है। वह राजाओं का भी राजा है॥ २॥
P0049L03,"जिस समय हरि नाम के यश व गुणों का चिन्तन किया जाए, वह करोड़ों तीर्थों के स्नान के पुण्य-फल के समान है।"
P0049L04,"हरि स्मरण द्वारा रसना गुणों वाली हो जाती है, पुनः उसके तुल्य कोई दान नहीं है।"
P0049L05,"अकालपुरुष दयालु एवं मेहरबान है, वह अपनी कृपा-दृष्टि द्वारा जीव के मन व तन में विराजमान होता है।"
P0049L06,"जीव को तन एवं धन उस परमात्मा का दिया हुआ है, मैं उस पर सदैव ही न्यौछावर हूँ॥ ३॥"
P0049L07,"जिसे कर्ता-पुरुष परमात्मा अपने साथ मिला ले, वह परमात्मा से मिला ही रहता है फिर कभी नहीं बिछुड़ता।"
P0049L08,सृजनहार प्रभु ने अपने सेवकों के माया रूपी बंधनों को काट दिया है।
P0049L09,अपने सेवकों के गुणों-अवगुणों का विचार किए बिना भूले हुए को भी भक्ति-मार्ग पर डाल देता है।
P0049L10,"नानक कथन करते हैं कि उस भगवान की शरण में पड़ जा, जो समस्त जीवों का आधार है॥ ४ ॥ १८ ॥ ८८ ॥"
P0049L11,श्रीरागु महला ५ ॥
P0049L12,यदि सत्य परमात्मा को रसना द्वारा स्मरण किया जाए तो जीव का मन एवं तन दोनों पवित्र हो जाते हैं।
P0049L13,जीव के माता-पिता एवं अन्य सगे-संबंधी तो बहुत होते हैं किन्तु इहलोक एवं परलोक में उस परमात्मा के सिवाय अन्य कोई सहायक नहीं है।
P0049L14,परमात्मा यदि अपनी कृपा-दृष्टि करे तो मनुष्य उसको क्षण-मात्र के लिए भी विस्मृत नहीं करता ॥ १॥
P0049L15,"हे मेरे मन ! जब तक तेरे प्राण हैं, उस सत्य परमात्मा का सिमरन करता जा।"
P0049L16,उस परमात्मा के अलावा समस्त सृष्टि मिथ्या है और अंत में नाश हो जाने वाली हैII१II रहाउ II
P0049L17,मेरा परमात्मा बड़ा निर्मल है। उसके बिना मैं कभी नहीं रह सकता।
P0049L18,मेरे मन एवं तन के भीतर परमेश्वर हेतु परम तृष्णा है। कोई भी आकर उससे मुझे मिला दे।
P0049L19,"मैंने चारों दिशाओं में उसकी खोज कर ली है, परम-पिता परमेश्वर के बिना अन्य कोई भी विश्राम स्थल नहीं ॥ २॥"
P0049L20,"उस गुरु के समक्ष प्रार्थना कर, जो तुझे इस सृष्टि के सृजनहार से तेरा मिलाप करवा दे।"
P0049L21,"सतिगुरु जी नाम के दाता हैं, जिनके पास भक्ति का पूर्ण भंडार है।"
