PID,Gist_Hindi_by_Sant_Singh
P0001L01,"ੴ- इस शब्द का शुद्ध उच्चारण है - 'एक ओंकार'। इसके उच्चारण में इसके तीन अंश किए जाते हैं। इन तीनों के भावार्थ भी अलग-अलग ही हैं। १ - एक (अद्वितीय)। ऑ- वही। ओंकार (~) निरंकार ; अर्थात्-ब्रह्म, करतार, ईश्वर, परमात्मा, भगवान, वाहिगुरु । १ ऑ- निरंकार वही एक है। सति नामु - उसका नाम सत्य है। करता - वह सृष्टि व उसके जीवों की रचना करने वाला है। पुरखु - वह यह सब कुछ करने में परिपूर्ण (शक्तिवान) है। निरभउ - उसमें किसी तरह का भय व्याप्त नहीं। अर्थात् - अन्य देव-दैत्यों तथा सांसारिक जीवों की भाँति उसमें द्वेष अथवा जन्म-मरण का भय नहीं है ; वह इन सबसे परे हैं। निरवैरु- वह बैर (द्वेष/दुश्मनी) से रहित है। अकाल- वह काल (मृत्यु) से परे है; अर्थात्-वह अविनाशी है। मूरति - वह अविनाशी होने के कारण उसका अस्तित्व सदैव रहता है। अजूनी - वह कोई योनि धारण नहीं करता, क्योंकि वह आवागमन के चक्कर से रहित है। सैभं - वह स्वयं से प्रकाशमान हुआ है। गुर - अंधकार (अज्ञान) में प्रकाश (ज्ञान) करने वाला (गुरु)। प्रसादि- कृपा की बख्शिश। अर्थात्-गुरु की कृपा से यह सब उपलब्ध हो सकता है।"
P0001L02,जाप करो। (इसे गुरु की वाणी का शीर्षक भी माना गया है।)
P0001L03,"निरंकार (अकाल पुरुष) सृष्टि की रचना से पहले सत्य था, युगों के प्रारम्भ में भी सत्य (स्वरूप) था।"
P0001L04,"अब वर्तमान में भी उसी का अस्तित्व है, श्री गुरु नानक देव जी का कथन है  भविष्य में भी उसी सत्यस्वरूप निरंकार का अस्तित्व होगा II १ II"
P0001L05,यदि कोई लाख बार शौच (स्नानादि) करता रहे तो भी इस शरीर के बाहरी स्नान से मन की पवित्रता नहीं हो सकती। मन की पवित्रता के बिना परमेश्वर (वाहिगुरु) के प्रति विचार भी नहीं किया जा सकता।
P0001L06,यदि कोई एकाग्रचित्त समाधि लगाकर मुँह से चुप्पी धारण कर ले तो भी मन की शांति (चुप) प्राप्त नहीं हो सकती; जब तक कि मन से झूठे विकार नहीं निकल जाते।
P0001L07,बेशक कोई जगत् की समस्त पुरियों के पदार्थों को ग्रहण कर ले तो भी पेट से भूखे रह कर (व्रत आदि करके) इस मन की तृष्णा रूपी भूख को नहीं मिटा सकता।
P0001L08,चाहे किसी के पास हज़ारों-लाखों चतुराई भरे विचार हों लेकिन ये सब अहंयुक्त होने के कारण परमेश्वर तक पहुँचने में कभी सहायक नहीं होते।
P0001L09,"अब प्रश्न पैदा होता है कि फिर परमात्मा के समक्ष सत्य का प्रकाश पुंज कैसे बना जा सकता है, हमारे और निरंकार के बीच मिथ्या की जो दीवार है वह कैसे टूट सकती है ?"
P0001L10,सत्य रूप होने का मार्ग बताते हुए श्री गुरु नानक देव जी कथन करते हैं - यह सृष्टि के प्रारंभ से ही लिखा चला आ रहा है कि ईश्वर के आदेश अधीन चलने से ही सांसारिक प्राणी यह सब कर सकता है II १ II
P0001L11,"(सृष्टि की रचना में) समस्त शरीर (निरंकार के) आदेश द्वारा ही रचे गए हैं, किन्तु उसके आदेश को मुँह से शब्द निकाल कर ब्यान नहीं किया जा सकता।"
P0001L12,"परमेश्वर के आदेश से (इस धरा पर) अनेकानेक योनियों में जीवों का सृजन होता है, उसी के आदेश से ही मान-सम्मान (अथवा ऊँच - नीच का पद) प्राप्त होता है।"
P0001L13,"परमेश्वर (वाहिगुरु) के आदेश से ही जीव श्रेष्ठ अथवा निम्न जीवन प्राप्त करता है, उसके द्वारा ही लिखे गए आदेश से जीव सुख और दुख की अनुभूति करता है।"
P0001L14,"परमात्मा के आदेश से ही कई जीवों को कृपा मिलती है, कई उसके आदेश से आवागमन के चक्र में फँसे रहते हैं।"
P0001L15,"उस सर्वोच्च शक्ति परमेश्वर के अधीन ही सब-कुछ रहता है, उससे बाहर संसार का कोई कार्य नहीं है।"
P0001L16,हे नानक ! यदि जीव उस अकाल पुरुष के आदेश को प्रसन्नचित्त होकर जान ले तो कोई भी आहंकारमयी 'मैं' के वश में नहीं रहेगा। यही अहंतत्व सांसारिक वैभव में लिप्त प्राणी को निरंकार के निकट नहीं होने देता॥ २ II
P0001L17,"(परमेश्वर की कृपा से ही) जिस किसी के पास आत्मिक शक्ति है, वही उस (सर्वशक्तिमान) की ताकत का यश गायन कर सकता है।"
P0001L18,कोई उसके द्वारा प्रदत बख्शिशों को (उसकी) कृपादृष्टि मानकर ही उसकी कीर्ति का गुणगान कर रहा है।
P0001L19,कोई जीव उसके अकथनीय गुणों व महिमा को गा रहा है।
P0001L20,कोई उसके विषम विचारों (ज्ञान) का गान विद्या द्वारा कर रहा है।
P0001L21,कोई उसका गुणगान रचयिता व संहारक ईश्वर का रूप जानकर करता है।
P0001L22,कोई उसका बखान इस प्रकार करता है कि वह परम सत्ता जीवन देकर फिर वापिस ले लेती है।
P0001L23,कोई जीव उस निरंकार को स्वयं से दूर जानकर उसका यश गाता है।
P0002L01,कोई उसे अपने अंग-संग जानकर उसकी महिमा गाता है।
P0002L02,अनेकानेक ने उसकी कीर्ति का कथन किया है किन्तु फिर अन्त नहीं हुआ।
P0002L03,"करोड़ों जीवों ने उसके गुणों का कथन किया है, फिर भी-उसका वास्तविक स्वरूप पाया नहीं जा सका।"
P0002L04,"अकाल पुरुष दाता बनकर जीव को भौतिक पदार्थ (अथक) देता ही जा रहा है, (परंतु) जीव लेते हुए थक जाता है।"
P0002L05,समस्त जीव युगों-युगों से इन पदार्थों का भोग करते आ रहे हैं।
P0002L06,आदेश करने वाले निरंकार की इच्छा से ही (सम्पूर्ण सृष्टि के) मार्ग चल रहे हैं।
P0002L07,श्री गुरु नानक देव जी सृष्टि के जीवों को सुचेत करते हुए कहते हैं कि वह निरंकार (वाहिगुरु) चिंता रहित होकर (इस संसार के जीवों पर) सदैव प्रसन्न रहता है॥ ३॥
P0002L08,"वह अकाल पुरुष (निरंकार) अपने सत्य नाम के साथ स्वयं भी सत्य है, उस (सत्य एवं सत्य नाम वाले) को प्रेम करने वाले ही अनंत कहते हैं।"
P0002L09,"(समस्त देव, दैत्य, मनुष्य तथा पशु इत्यादि) जीव कहते रहते हैं, माँगते रहते हैं, (भौतिक पदार्थ) दे दे करते हैं, वह दाता (परमात्मा) सभी को देता ही रहता है।"
P0002L10,अब प्रश्न उत्पन्न होते हैं कि (जैसे अन्य राजा - महाराजाओं के समक्ष कुछ भेंट लेकर जाते हैं वैसे ही) उस परिपूर्ण परमात्मा के समक्ष क्या भेंट ले जाई जाए कि उसका द्वार सरलता से दिखाई दे जाए ?
P0002L11,जुबां से उसका गुणगान किस प्रकार का करें कि सुनकर वह अनंत शक्ति (ईश्वर) हमें प्रेम- प्रशाद प्रदान करे ?
P0002L12,"इनका उत्तर गुरु महाराज स्पष्ट करते हैं कि प्रभात काल (अमृत वेला) में (जिस समय व्यक्ति का मन आम तौर पर सांसारिक उलझनों से विरक्त होता है) उस सत्य नाम वाले अकाल पुरुष का नाम-स्मरण करें और उसकी महिमा का गान करें, तभी उसका प्रेम प्राप्त कर सकते हैं।"
P0002L13,"(इससे यदि उसकी कृपा हो जाए तो) गुरु जी बताते हैं कि कर्म मात्र से जीव को यह शरीर रूपी कपड़ा अर्थात् मानव जन्म प्राप्त होता है, इससे मुक्ति नहीं मिलती, मोक्ष प्राप्त करने के लिए उसकी कृपामयी दृष्टि चाहिए।"
P0002L14,हे नानक ! इस प्रकार का बोध ग्रहण करो कि वह सत्य स्वरूप निरंकार ही सर्वस्व है इससे मनुष्य की समस्त शंकाएँ मिट जाएँगी॥ ४ ॥
P0002L15,"वह परमात्मा किसी के द्वारा मूर्त रूप में स्थापित नहीं किया जा सकता, न ही उसे बनाया जा सकता है।"
P0002L16,वह मायातीत होकर स्वयं से ही प्रकाशमान है।
P0002L17,जिस मानव ने उस ईश्वर का नाम-स्मरण किया है उसी ने उसके दरबार में सम्मान प्राप्त किया है।
P0002L18,श्री गुरु नानक देव जी का कथन है कि उस गुणों के भण्डार निरंकार की बंदगी करनी चाहिए।
P0002L19,"उसका गुणगान करते हुए, प्रशंसा सुनते हुए अपने ह्रदय में उसके प्रति श्रद्धा धारण करें।"
P0002L20,ऐसा करने से दुखों का नाश होकर घर में सुखों का वास हो जाता है।
P0002L21,"गुरु के मुँह से निकला हुआ शब्द ही वेदों का ज्ञान है, वही उपदेश रूपी ज्ञान सभी जगह विद्यमान है।"
P0002L22,"गुरु ही शिव, विष्णु, ब्रह्मा और माता पार्वती है, क्योंकि गुरु परम शक्ति हैं।"
P0002L23,"यदि मैं उस सर्गुण स्वरूप परमात्मा के बारे में जानता भी हूँ तो उसे कथन नहीं कर सकता, क्योंकि उसका कथन किया ही नहीं जा सकता।"
P0002L24,हे सच्चे गुरु ! मुझे सिर्फ यही समझा दो कि
P0002L25,समस्त जीवों का जो एकमात्र दाता है मैं कभी भी उसे भूल न पाऊं ॥ ५॥
P0002L26,"तीर्थ-स्नान भी तभी किया जा सकता है यदि ऐसा करना उसे स्वीकार हो, उस अकाल पुरुष की इच्छा के बिना में तीर्थ-स्नान करके क्या करूँगा, क्योंकि फिर तो यह सब अर्थहीन ही होगा।"
P0002L27,"उस रचयिता की पैदा की हुई जितनी भी सृष्टि मैं देखता हूँ, उसमें कर्मों के बिना न कोई जीव कुछ प्राप्त करता है और न ही उसे कुछ मिलता है।"
P0002L28,"यदि सच्चे गुरु का मात्र एक ज्ञान ग्रहण कर लिया जाए तो मानव जीव की बुद्धि रत्न, जवाहर व माणिक्य जैसे पदार्थों से परिपूर्ण हो जाए।"
P0002L29,हे गुरु जी ! मुझे सिर्फ यही बोध करवा दो कि
P0002L30,सृष्टि के समस्त प्राणियों को देने वाला निरंकार मुझ से विस्मृत न हो ॥ ६ ॥
P0002L31,"यदि किसी मनुष्य अथवा योगी की योग-साधना करके चार युगों से दस गुणा अधिक, अर्थात्-चालीस युगों की आयु हो जाए।"
P0002L32,"नवखण्डों (पौराणिक धर्म-ग्रन्थों में वर्णित इलावृत, किंपुरुष, भद्र, भारत, केतुमाल, हरि, हिरण्य, रम्य और कुश) में उसकी कीर्ति हो, सभी उसके सम्मान में साथ चलें।"
P0002L33,संसार में प्रख्यात पुरुष बनकर अपनी शोभा का गान करवाता रहे।
P0002L34,यदि अकाल पुरुष की कृपादृष्टि में वह मनुष्य नहीं आया तो किसी ने भी उसकी क्षेम नहीं पूछनी।
P0002L35,"इतने वैभव तथा मान-सम्मान होने के बावजूद भी ऐसा मनुष्य परमात्मा के समक्ष कीटों मे क्षुद्र कीट अर्थात् अत्यंत अधम समझा जाता है, दोषयुक्त मनुष्य भी उसे दोषी समझेंगे।"
P0002L36,गुरु नानक जी का कथन है कि वह असीम-शक्ति निरंकार गुणहीन मनुष्यों को गुण प्रदान करता है और गुणी मनुष्यों को अतिरिक्त गुणवान बनाता है।
P0002L37,"परंतु ऐसा कोई और दिखाई नहीं देता, जो उस गुणों से परिपूर्ण परमात्मा को कोई गुण प्रदान कर सके II७ ॥"
P0002L38,"परमात्मा का नाम सुनने, अर्थात्-उसकी कीर्ति में अपने हृदय को लगाने के कारण ही सिद्ध, पीर, देव तथा नाथ इत्यादि को परम-पद की प्राप्ति हुई है।"
P0002L39,"नाम सुनने से ही पृथ्वी, उसको धारण करने वाले वृषभ (पौराणिक धर्न ग्रन्थों के अनुसार जो धौला बैल इस भू-लोक को अपने सीगों पर टिकाए हुए है) तथा आकाश के स्थायित्व की शक्ति का ज्ञान प्राप्त हो जाता है।"
P0002L40,"नाम सुनने से शाल्मलि, क्रौंच, जम्बू, पलक आदि सप्त द्वीपः भूः भवः, स्वः आदि चौदह लोक तथा अतल, वितल, सुतल आदि सातों पातालों की अन्तर्यामता प्राप्त होती है।"
P0002L41,नाम सुनने वाले को काल स्पर्श भी नहीं कर सकता।
P0002L42,"हे नानक ! प्रभु के भक्त में सदैव आनंद का प्रकाश रहता है,"
P0002L43,परमात्मा का नाम सुनने से समस्त दुखों व दुष्कर्मो का नाश होता है॥ ८॥
P0002L44,"परमात्मा का नाम सुनने से ही शिव, ब्रह्मा तथा इन्द्र आदि उत्तम पदवी को प्राप्त कर सके हैं।"
P0002L45,मंदे लोग यानी कि बुरे कर्म करने वाले मनुष्य भी नाम को श्रवण करने मात्र से प्रशंसा के लायक हो जाते हैं।
P0002L46,"नाम के साथ जुड़ने से योगादि तथा शरीर के विशुद्ध, मणिपूरक, मूलाधार आदि षट्-चक्र के रहस्य का बोध हो जाता है।"
P0002L47,"नाम सुनने से षट्-शास्त्र, (सांख्य, योग, न्याय आदि), सत्ताईस स्मृतियों (मनु, याज्ञवल्कय स्मृति आदि) तथा चारों वेदों का ज्ञान उपलब्ध होता है।"
P0002L48,हे नानक ! संत जनों के हृदय में सदैव आनंद का प्रकाश रहता है।
P0003L01,परमात्मा का नाम सुनने से समस्त दुखों व दुष्कर्मो का नाश होता हैII ९ II
P0003L02,"नाम सुनने से मनुष्य को सत्य, संतोष व ज्ञान जैसे मूल धमों की प्राप्ति होती है।"
P0003L03,नाम को सुनने मात्र से समस्त तीर्थों में श्रेष्ठ अठसठ तीथों के स्नान का फल प्राप्त हो जाता है।
P0003L04,निरंकार के नाम को सुनने के बाद बार-बार रसना पर लाने वाले मनुष्य को उसके दरबार में सम्मान प्राप्त होता है।
P0003L05,"नाम सुनने से परमात्मा में लीनता सरलता से हो जाती है, क्योंकि इससे आत्मिक शुद्धि होकर ज्ञान प्राप्त होता है।"
P0003L06,हे नानक ! प्रभु के भक्तों को सदैव आत्मिक आनंद का प्रकाश रहता है।
P0003L07,परमात्मा का नाम सुनने से समस्त दुखों व दुष्कर्मो का नाश होता है॥ १०॥
P0003L08,नाम सुनने से गुणों के सागर श्री हरि में लीन हुआ जा सकता है।
P0003L09,"नाम-श्रवण के प्रभाव से ही शेख, पीर और बादशाह अपने पद पर शोभायमान हैं।"
P0003L10,अज्ञानी मनुष्य प्रभु-भक्ति का मार्ग नाम-श्रवण करने से ही प्राप्त कर सकते हैं।
P0003L11,इस भव-सागर की अथाह गहराई को जान पाना भी नाम-श्रवण की शक्ति से सम्भव हो सकता है।
P0003L12,हे नानक ! सद्-पुरुषों के अंतर में सदैव आनंद का प्रकाश रहता है।
P0003L13,परमात्मा का नाम सुनने से समस्त दुखों व दुष्कर्मो का नाश होता है।॥ ११॥
P0003L14,उस अकाल पुरुष का नाम सुनने के पश्चात उसे मानने वाले अर्थात् उसे अपने हृदय में बसाने वाले मनुष्य की अवस्था कथन नहीं की जा सकती।
