PID,Gist_Hindi_by_Sant_Singh
P0022L11,"जैसे जल डालने से अग्नि बुझ जाती है, वैसे तृष्णाग्नि गुरु-भक्ति रूपी जल से दासों की दास बन जाती है।"
P0022L12,इससे जीव यमों के दण्ड से बच जाता है और स्वयं भी भवसागर से पार हो जाता है तथा अन्य को भी पार होने में सहायता करता है॥ २॥
P0022L13,"गुरु के उन्मुख जीवों को असत्य अच्छा नहीं लगता, वे प्रायः सत्य परमात्मा में लिप्त रहते हैं और सत्य ही उनको भाता है।"
P0022L14,"शक्ति उपासक (शाक्त) गुरु से विमुख जीव को सत्य नहीं भाता, असत्य की नीव भी असत्य ही होती है।"
P0022L15,"पूर्ण गुरु से मिल कर जो सत्य नाम में रम रहे हैं, वे गुरमुख सत्य होकर सत्य स्वरूप परमात्मा में अभेद हो रहे हैं।॥ ३॥"
P0022L16,"मन में माणिक्य, लाल, हीरे, रत्न के तुल्य हरि-नाम पदार्थ विद्यमान है।"
P0022L17,"वह गहन-गम्भीर प्रभु प्रत्येक हृदय में वास करता है, उसका नाम-धन ही सच्चा सौदा है।"
P0022L18,नानक जी कहते हैं कि हीरे की भाँति अमूल्य हरि यदि कृपा करे तो गुरु द्वारा ही नाम रूपी सच्चा सौदा प्राप्त किया जा सकता है॥४॥२१॥
P0022L19,श्रीरागु महला १ ॥
P0022L20,"देश-देशान्तर का भ्रमण करने से भी भ्रमाग्नि शांत नहीं होती, चाहे कोई कितना भी भ्रमण क्यों न कर ले।"
P0022L21,"अंतर्मन से मैल दूर नहीं होती, ऐसे जीवन को धिक्कार है, ऐसे भेष को भी धिक्कार है।"
P0022L22,सतिगुरु के उपदेश बिना किसी भी प्रकार से प्रभु की भक्ति नहीं हो सकती ॥ १॥
P0022L23,हे प्रिय मन ! गुरु के मुँह से निकलने वाले उपदेश द्वारा नाम जल लेकर तृष्णाग्नि को बुझा ले।
P0022L24,यदि गुरु-उपदेश मन में बस जाए तो अहंकार व तृष्णग्नि जैसे सभी विकार नष्ट हो जाते हैं। १॥ रहाउ ॥
P0022L25,"परमात्मा के नाम में लिवलीन होकर यह मन अमूल्य माणिक्य बन जाता है, और प्रतिष्ठित होता है।"
P0022L26,"लेकिन परमात्मा का नाम सत्संगति करने से ही प्राप्त होता है, गुरु की शरण पड़ने से ही परमात्मा के चरणों में सुरति लगती है।"
P0022L27,"अहंकार दूर होने से सुख प्राप्त होता है। तब जीवात्मा परमात्मा में उसी प्रकार विलीन हो जाती है, जैसे जल में जल मिल जाता है॥ २॥"
P0022L28,"जिस ने हरि-हरि नाम का सुमिरन नहीं किया, वह अपने अवगुणों के फलस्वरूप आवागमन के चक्र में ही पड़ा रहता है।"
P0022L29,"जिस ने सतिगुरु महापुरुषों के साथ भेंट नहीं की, वे भवसागर में स्वयं भी दुखों के साथ खपता है और अन्य जीवों को भी खपाता है।"
P0022L30,यह अमूल्य रत्नों के समान मानव जन्म यूं ही कौड़ी के बदले व्यर्थ चला जाता है॥ ३॥
P0022L31,"जिन को सतिगुरु जी प्रसन्न होकर मिले हैं, वे पुरुष पूर्ण ज्ञानी हैं।"
P0022L32,गुरु से मिल कर ही भवसागर पार किया जा सकता है तथा परलोक में सम्मान प्राप्त होता है।
P0022L33,नानक जी कथन करते हैं कि उनके मुख उज्ज्वल होते हैं जिन के मुख से नाम-ध्वनि उत्पन्न हो रही हो और जो गुरु के उपदेश का प्रतीक हैं॥४॥२२॥
P0022L34,श्रीरागु महला १ ॥
P0022L35,हे जीव रूपी व्यापारियो! नाम रूपी व्यापार करो और सौदा सम्भाल कर रख लो।
P0022L36,गुरु-उपदेशानुसार ऐसी वस्तु का क्रय करो जो सदा तुम्हारे साथ रहे।
P0022L37,"आगे परलोक में परमात्मा रूपी सौदागर बहुत सूझवान बैठा है, वह तुम्हारी वस्तु की सम्भाल कर लेगा। अर्थात्-तुम्हारे सौदे को वह जांच-परख कर ही ग्रहण करेगा ॥१॥"
P0022L38,हे भाई ! एकाग्रचित होकर राम-नाम जपो।
P0022L39,"इस संसार में जो श्वास रूपी पूंजी लेकर आए हो, इससे हरि यश का सौदा खरीद कर ले चलो, जिसे देख कर पति-परमात्मा प्रसंन होगा ॥ १॥ रहाउ॥"
P0023L01,"जिनके पास सत्य नाम की पूँजी नहीं है, उनको आत्मिक सुख कैसे प्राप्त हो सकता है।"
P0023L02,पाप रूपी अनिष्टकारी पदार्थ क्रय कर लेने से मन व तन भी दूषित हो जाता है।
P0023L03,"ऐसे जीव की दशा जाल में फँसे मृग के समान होती है, यह नित्य प्रति गहन दुखों को सहता हुआ रोता है॥ २॥"
P0023L04,"जिस प्रकार खोटा सिक्का खजाने में नहीं पड़ता, वैसे ही मिथ्या जीव को परमात्मा का साक्षात्कार नहीं होता।"
P0023L05,"मिथ्या जीव की न कोई जाति है न उसकी कोई प्रतिष्ठा होती है, पाप कर्म करने वाले जीव को आत्मिक जीवन में कभी सफलता नहीं मिलती।"
P0023L06,"मिथ्या पुरुषों के कर्म भी मिथ्या ही होते हैं, इसलिए वे आवागमन में ही अपनी प्रतिष्ठा गंवा लेते हैं।॥ ३॥"
P0023L07,गुरु नानक जी कथन करते हैं कि हमें गुरु उपदेश द्वारा प्रभु का यशोगान करने हेतु मन को समझाना चाहिए।
P0023L08,जो प्रभु-प्रेम में रंगे होते हैं उनको न पापों का भार तथा न ही कोई भ्रम होता है।
P0023L09,ऐसे जीवों को हरि के नाम-सुमेिरन का बहुत लाभ मिलता है तथा उनके मन में निर्भय परमात्मा का वास होता है॥ ४ ॥ २३ ॥
P0023L10,श्रीरागु महला १ घरु २ ॥
P0023L11,"मानव जीवन में धन व यौवन तो फूल की भाँति चार दिनों के अतिथि हैं, जो चले जाएँगे।"
P0023L12,यह पद्मनी के पतों के समान गिर कर गल-सड़ कर नष्ट हो जाने वाले हैं।॥ १॥
P0023L13,"अतः हे जीव ! जब तक यौवन में नवोल्लास है, तब तक नाम-सुगिरन का आनन्द प्राप्त कर ले।"
P0023L14,"तुम्हारे यौवनावस्था के दिन कम रह गए हैं, क्योंकि तुम्हारा शरीर रूपी चोला अब वृद्ध हो गया है॥ १॥ रहाउ॥"
P0023L15,मेरे प्रिय मित्र भी (वृद्धावस्था उपरांत) श्मशान में जाकर गहरी निद्रा में सो गए हैं अर्थात्-मृत्यु को प्राप्त हो गए हैं।
P0023L16,मैं भी दुविधा में यहाँ जाकर धीमे स्वर में रोऊं॥ २॥
P0023L17,हे सुन्दर जीव रूपी नारी! तुम अपने कानों से ध्यानपूर्वक यह बात क्यों नहीं सुन रही कि तुझे भी परलोक रूपी ससुराल में आना है।
P0023L18,मायके रूपी इस लोक में तुम्हारा सदा के दिए वास नहीं हो सकता॥ ३॥
P0023L19,"नानक जी कहते हैं कि जो जीवात्मा निश्चित होकर इस लोक में आज्ञान निद्रा में लीन है, उसे दिन के प्रकाश में ही सेंध लग रही है।"
P0023L20,यह जीव रूप स्त्री सद्गुणों की गठरी गंवा कर अवगुणों को एकत्रित करके चल पड़ी है॥ ४॥ २४॥
P0023L21,श्रीरागु महला १ घरु दूजा २ ॥
P0023L22,"वह परिपूर्ण परमात्मा स्वयं ही रसिया है, स्वयं ही रस रूप है तथा स्वयं ही रमण करने वाला है।"
P0023L23,"स्वयं स्त्री रूप हो रहा है, स्वयं ही सेज और स्वयं ही पति रूप में व्याप्त है ॥१॥"
P0023L24,समस्त रूपों में मेरा स्वामी परिपूर्ण होकर रमण कर रहा है॥ १॥ रहाउ॥
P0023L25,"वह स्वयं ही मछुआ है, स्वयं मछली रूप में है, स्वयं जल है और स्वयं ही जाल रूप हो रहा है।"
P0023L26,स्वयं ही जाल के आगे बंधा हुआ लोहे का मनका है तथा स्वयं ही उस जाल में लगा हुआ माँस का टुकड़ा (लालु) है; अर्थात्- सर्वस्व स्वयं वह परमेश्वर ही है॥ २॥
P0023L27,सतिगुरु जी कथन करते हैं कि हे सखी ! मेरा प्रियतम प्रभु स्वयं ही अनेक तरह के आनन्द वाला हो रहा है।
P0023L28,"वह नित्य ही सुहागिनों (प्रभु-प्रेमियों) को प्रीत करता है, हम द्वैत-भावी जीवों का हाल बहुत बुरा है॥ ३॥"
P0023L29,"गुरु नानक जी कथन करते हैं कि हे जीव ! तुम यही विनती करो कि हे परम पिता ! तुम ही स्वयं सरोवर हो, उस पर रहने वाले हंस भी तुम ही हो।"
P0023L30,"तुम स्वयं ही कमल हो, कुमुदिनी भी तुम हो, इन सब को देख कर तुम स्वयं ही प्रसंन होने वाले हो! ।। ४॥ २५॥"
P0023L31,श्रीरागु महला १ घरु ३ ॥
P0023L32,इस तन रूपी भूमि में सद्कर्मो का बीजारोपण करके प्रभु-चिन्तन रूपी जल से इसकी सिंचाई करो।
P0023L33,"मन को कृषक बना कर हृदय में हरि-प्रभु को उगाओ, अर्थात् हृदय में प्रभु को धारण करो तथा इस तरह निर्वाण-पद रूपी फसल प्राप्त कर लोगे ॥ १॥"
P0023L34,हे विमूढ़ जीव ! माया का अभिमान क्यों करता है।
P0023L35,"माता, पिता, पुत्र व स्त्री आदि समस्त सगे-सम्बन्धी अंत समय में तेरे सहायक नहीं होंगे II रहाउ II"
P0023L36,"जिस प्रकार नदीन (खरपतवार) खेती में उग जाते हैं और कृषक उन्हें उखाड़ फेंकता है, इसी प्रकार हे मानव ! विषय-विकार रूपी नदीनों को हृदय में पनप रही खेती में से उखाड़ कर फॅक दो और इन विकारों को त्याग कर मन की एकाग्रता से प्रभु को स्मरण करो।"
P0023L37,"जप, तप, संयम जब शरीर रूपी भूमि के रक्षक हो जाते हैं तो हृदय में कमल खिलता है और उस में से ब्रह्मानंद रूपी शहद टपक पड़ता है॥ २ ॥"
P0023L38,"जब मनुष्य पाँच स्थूल तत्त्व, पाँच सूक्ष्म तत्त्व, पाँच ज्ञानेन्द्रियाँ, पाँच कर्मेन्द्रियाँ, पाँच प्राण तथा मन व बुद्धि के निवास स्थान वश में करे, तीनों अवस्थाओं-बाल्यावस्था, युवावस्था व जरावस्था में काल को स्मरण रखें।"
P0023L39,दस दिशाओं तथा समस्त वनस्पतियों में अपरम्पार परमेश्वर को जाने तो हे नानक ! ऐसा एकमेय अद्वितीय प्रभु उसको भवसागर से पार उतार लेगा ॥ ३॥ २६॥
P0024L01,श्रीरागु महला १ घरु ३ ॥
P0024L02,गुरु जी कथन करते हैं कि हे जीव ! शुभ कर्मों को भूमि बना कर उसमें गुरु-उपदेश रूपी बीज का रोपण करो और सत्य-नाम रूपी जल से इसकी सिंचाई करो।
P0024L03,"इस प्रकार तुम कृषक बन कर धार्मिक-निष्ठा को उत्पन्न करो, इससे तुझे स्वर्ग-नरक का ज्ञान प्राप्त होगा I १II"
P0024L04,यह मत समझ लेना केि ज्ञान केवल बातों से ही प्राप्त हो जाता है।
P0024L05,घन-सम्पति के अभिमान तथा रूप की शोभा में तुम ने अपना जन्म निष्फल ही गंवा लिया है॥ १॥ रहाउ ॥
P0024L06,"मानव शरीर में अवगुण कीचड़ की भाँति हैं तथा मन मेंढक समान, ऐसे में निकट ही विकसित हुए कमल की उसे कोई सूझ नहीं है। अर्थात्-अवगुणों के कीचड़ में फँसे मानव मन रूपी मेंढक ने परमात्मा रूपी कमल की पहचान कदाचित नहीं की है।"
P0024L07,"गुरु रूपी मैंनरा नित्य प्रति आकर अपनी भाषा बोलता है, अर्थात-उपदेश देता है, लेकिन मेंढक रूपी मानव मन इसे कैसे समझ सकता है, जब तक प्रभु स्वयं इस मन को समझा न दे॥ २॥"
P0024L08,"जिनका मन माया में रंजित है, उनको उपदेश देना अथवा उनके द्वारा उपदेश अवण करना (पवन की वाणी ) व्यर्थ की बात है।"
P0024L09,"स्वामी की कृपा-दृष्टि में तथा हृदय में प्रिय वही जीव हैं, जिन्होंने एक परमेश्वर को स्मरण किया है॥ ३॥"
P0024L10,"हे काजी ! सुनो, तुम तीस रोज़े रखते हो, तथा पाँच समय की नमाज़ तुम्हारी साथीं  है, किन्तु देखना, कहीं ऐसा न हो (कान, क्रोध, लोभ, मोह व अहंकार में से कोई) शैतान इन को नष्ट न कर दे।"
P0024L11,"गुरु जी कहते हैं कि हे काज़ी ! एक दिन तुम ने भी मृत्यु-मार्ग पर चलना है, फिर यह धन-सम्पति तुम किस के लिए संग्रहित कर रहे हो ॥ ४॥ २७ ॥"
P0024L12,श्रीरागु महला १ घरु ४ ॥
P0024L13,"वही परमात्मा है, जिसने इस जगत् को प्रफुल्लित किया है तथा संसार को हरा-भरा किया है।"
P0024L14,"जिस परमात्मा ने पानी व पृथ्वी आदि पाँच तत्वों से सम्पूर्ण सृष्टि को बांध रखा है, वह सृजनहार परमात्मा धन्य है॥ १॥"
P0024L15,हे मुल्लां ! मृत्यु अपरिहार्य है।
P0024L16,परमात्मा से डरना चाहिए॥ १॥ रहाउ॥
P0024L17,"तभी तुम श्रेष्ठ मुल्लां हो सकते हो, तभी तुम श्रेष्ठ काजी हो सकते हो, यदि तुम परमात्मा के नाम के बारे में जानते हो।"
P0024L18,यदि तुम बहुत विद्वान हो तो भी तुम मृत्यु से बच कर नहीं रह सकते अर्थात् पनधड़ी की भाँति भर जाने पर डूब जाओगे॥ २॥
P0024L19,"असली काज़ी तो वही है, जिस ने अहंत्व का त्याग किया है और एक प्रभु के नाम का आश्रय लिया है।"
P0024L20,"सत्य सृष्टि का सृजनहार आज भी है, भविष्य में भी होगा, उसकी यह रचना तो नष्ट हो जाएगी, किन्तु वह नष्ट नहीं होगा ॥ २॥"
P0024L21,"बेशक तुम पांचों समय की नमाज़ पढ़ते हो, चाहे कुरान शरीफ आदि धार्मिक ग्रंथ भी पढ़ते हो।"
P0024L22,नानक देव जी कहते हैं कि हे काज़ी ! जब तुम्हें मृत्यु कब्र की ओर बुलाएगी तो तुम्हारा खाना-पीना ही समाप्त हो जाएगा।॥४॥२८॥
P0024L23,श्रीरागु महला १ घरु ४ ॥
P0024L24,गुरु जी कहते हैं कि जीव के साथ लोभ रूपी कुत्ता है तथा आशा व तृष्णा रूपी दो कुतियाँ हैं।
P0024L25,सदैव प्रातः होते ही ये आहार हेतु भौंकने लग जाते हैं।
P0024L26,"जीव के पास झूठ रूपी छुरा है, जिससे वह सांसारिक प्राणियों को ठग कर खाता है। अर्थात् जीव झूठ के आसरे अभक्ष्य पदार्थ सेवन करता है।"
P0024L27,हे प्रभु ! सांसारिक जीव हत्यारे के रूप में रह रहा है॥ १॥
P0024L28,जीव के लिए गुरु जी स्वयं को पुरुष मान कर कहते हैं कि मैंने उस प्रभु-पति की प्रतिष्ठित शिक्षा ग्रहण नहीं की तथा न ही कोई श्रेष्ठ कार्य किया है।
P0024L29,मैं ऐसे विकृत विकराल रूप में रह रहा हूँ।
P0024L30,हे प्रभु ! आपका एक नाम ही भवसागर पार करने वाला है!
P0024L31,मुझे इसी नाम की आशा है और इसी नाम का आश्रय है॥ १॥ रहाउ॥
P0024L32,मैं अपने मुंह से दिन-रात निन्दा करता रहता हूँ।
P0024L33,मैं निम्न वर्ग वाला चोरी करने हेतु पराए घरों की ओर देखता रहता हूँ।
P0024L34,इस देह में काम-क्रोधादि चाण्डाल बसते हैं।
P0024L35,हे प्रभु ! मैं हत्यारे के रूप में रह रहा हूँ॥ २॥
P0024L36,"मेरा ध्यान लोगों को फँसाने में लगा रहता है, यद्यपि मेरा बाह्य भेष फकीरों वाला है।"
P0024L37,मैं बड़ा ठग हूँ तथा दुनिया को ठग रहा हूँ।
P0024L38,"मैं स्वयं को बहुत चतुर समझता हूँ, लेकिन मेरे ऊपर पापों का बहुत भार पड़ा हुआ है।"
