PID,Gist_Hindi_by_Sant_Singh
P0071L16,भगवती जन अपनी धार्मिक क्रियाओं में लीन रहता है।
P0071L17,योगी अष्टांग-भाव से मुक्ति की कल्पना करते हैं।
P0071L18,तपस्वी लोग तपस्या में ही कल्याण मानते हैं। ॥२॥
P0071L19,मौनी साधु मौन धारण करने में ही ईश्वर की प्राप्ति संभव मानते हैं।
P0071L20,संन्यासी ब्रह्मचारी बन गया है।
P0071L21,उदासी वैराग्य में मग्न हुआ है ॥३॥
P0071L22,कोई कहता है कि वह नौ प्रकार की भक्ति करता है।
P0071L23,पण्डित वेदों को सस्वर उच्चारण करते हैं।
P0071L24,गृहस्थ-जन धर्मशास्त्रानुसार यज्ञ-दानादि धर्मो के पालन में ही कल्याण समझते हैं ॥४॥
P0071L25,कोई साधु एक नाम ‘अलख' ही बोलता है। कोई साधु बहुरूपिया बन गया है।
P0071L26,"कापड़िए साधु केसरिया कपड़े पहनते हैं, जागूता अर्थात् रात्रि जागरण करने वाले लोग भी जगराते में ही मोक्ष सम्भव मानते हैं।"
P0071L27,कुछ लोग तीर्थ-यात्रा में स्नान द्वारा भी प्रभु-प्राप्ति की संभावना स्वीकारते हैं ॥५॥
P0071L28,"निराहार रहने वाले व्रत को ही ईश्वर मिलन का साधन मानते हैं, ऊँची जाति के लोग निम्न जाति से परहेज करते हैं।"
P0071L29,कुछ लोग गुफाओं में छिपे रहते हैं और किसी को अपने दर्शन नहीं देते।
P0071L30,कुछ लोग अपने चित्त के भीतर ही बुद्धिमान हैं। ॥६॥
P0071L31,कोई भी अपने आपको कम नहीं कहता।
P0071L32,हर कोई कहता है कि उसने भगवान को पा लिया है।
P0071L33,लेकिन भगवान का भक्त वही होता है जिसे भगवान अपने साथ मिला लेता है ॥ ७॥
P0071L34,मैं समस्त युक्तियों एवं उपाय
P0071L35,त्याग कर भगवान की शरण में आ गया हूँ।
P0071L36,हे नानक ! भगवान की प्राप्ति हेतु गुरु के चरणों में पड़ना सर्वोत्तम युक्ति है ॥८॥२॥२७॥
P0071L37,"ईश्वर एक है, जिसे सतगुरु की कृपा से पाया जा सकता है।"
P0071L38,श्रीरागु महला १ घरु ३ ॥
P0071L39,हे ईश्वर ! तू सृष्टि में अनेक रूपों में विचरण कर रहा है। योगियों में तुम योगीराज हो
P0071L40,एवं भोगिर्यो में तुम महाभोगी हो।
P0071L41,"स्वर्ग लोक के देवता, मृत्युलोक के वासी तथा पाताल के नागादि जीवों ने तुम्हारा भेद नहीं पाया ॥१॥"
P0071L42,"मैं तुझ पर कुर्बान हूँ, मैं तेरे पावन नाम पर न्यौछावर हूँ ॥१॥ रहाउ॥"
P0071L43,"तुम सृष्टि कर्ता हो, तुम ने ही संसार की रचना करके"
P0071L44,उनकी किस्मत निर्धारत करके सांसारिक कार्यों में लगाया है।
P0071L45,अपनी रचना का तुम स्वयं ध्यान रखते हो और अपनी माया-शक्ति से इस संसार की चौपड़ पर निरन्तर पासा फेँक रहे हो ॥२॥
P0071L46,समूचे विश्व में तुम प्रत्यक्ष दिखते हो।
P0071L47,प्रत्येक प्राणी तेरे नाम की कामना करता है।
P0071L48,किन्तु सतिगुरु के बिना तुम्हें कोई भी प्राप्त नहीं कर सकता। समस्त प्राणी मोह-माया के जाल में लुभायमान होकर फंसे हुए हैं। ॥३॥
P0071L49,"मैं सतिगुरु पर बलिहार जाता हूँ,"
P0071L50,जिनके मिलन से परमगति प्राप्त होती है।
P0072L01,"सतिगुरु ने मुझे उस प्रभु बारे बताया है जिस परमात्मा को पाने की देवता, मानव और ऋषि-मुनि कामना करते हैं। ॥४॥"
P0072L02,सत्संगति किस प्रकार जानी जा सकती है?
P0072L03,एक प्रभु के नाम का वहाँ उच्चारण होता है।
P0072L04,"हे नानक ! हरिनाम ही ईश्वर का हुक्म है, यह बात मुझे गुरु जी ने समझा दी है ॥५॥"
P0072L05,यह संसार संदेह के कारण भ्रुम भुलैया में पड़ा हुआ है।
P0072L06,हे प्रभु ! तुमने स्वयं ही प्राणियों के कर्मानुसार उन्हें भुलाया है।
P0072L07,"वे प्राणी जिनके भाग्य में परमात्मा का मिलन नहीं, वियोगिनी स्त्री के समान प्रतिदिन तड़पते रहते हैं। ॥६॥"
P0072L08,दुहागिन नारियों के क्या लक्ष्ण हैं?
P0072L09,वे पति द्वारा उपेक्षित मान-रहित होकर भटकती रहती हैं।
P0072L10,उन दुर्भाग्यशाली नारियों की वेश-भूषा मलिन होती है और प्रतिदिन तड़प-तड़प कर रात्रि बिताती हैं ॥७॥
P0072L11,सुहागिन ने आखिर क्या शुभ कर्म कमाया है?
P0072L12,उसे ईश्वर ने पूर्व जन्म के किसी उत्तम कर्म का फल प्रदान किया है।
P0072L13,अपनी कृपा-दृष्टि करके परमेश्वर उनको अपने साथ मिला लेता है ॥८॥
P0072L14,"जिन जिज्ञासु प्राणियों ने परमात्मा के आदेश की पालना की है,"
P0072L15,वे गुरु का सच्चा उपदेश मन में धारण करते हैं।
P0072L16,"ऐसी सखियाँ सत्यवती पत्नी हैं, जो अपने पिया के साथ प्रीति करती हैं ॥९ ॥"
P0072L17,"जो ईश्वर की इच्छानुसार प्रसन्नता अनुभव करती हैं,"
P0072L18,उनके भीतर से संदेह निवृत्त हो जाते हैं।
P0072L19,हे नानक ! सतिगुरु ऐसा दयालु है जो सभी को भगवान के साथ मिला देता है ॥१०॥
P0072L20,वह सतिगुरु से मिलन करके हरि-नाम रूपी फल प्राप्त कर लेता है।
P0072L21,"जो अपने अहंकार को नाश कर देता है,"
P0072L22,उसकी मंद-बुद्धि की पीड़ा निवृत हो जाती है और उसके मस्तक पर भाग्योदय हो जाता है ॥११॥
P0072L23,हे प्रभु ! तेरी वाणी अमृत समान है।
P0072L24,यह तेरे भक्तों के मन में रमी हुई है।
P0072L25,तुम्हारी सेवा में ही वास्तविक सुख की उपलब्धि है और अपनी कृपा-दृष्टि से तुम अपने भक्तों को भवसागर से पार कर देते हो ॥१२॥
P0072L26,सतिगुरु से मिलन तभी समझा जाता है।
P0072L27,यदि इस मिलन द्वारा ईश्वर के नाम का उच्चारण किया जाए।
P0072L28,सतिगुरु के बिना किसी को भी प्रभु प्राप्त नहीं हुआ। सारी दुनिया धर्म-कर्म करते-करते थक गई है  ॥१३॥
P0072L29,मैं अपने सतिगुरु पर बलिहार जाता हूँ
P0072L30,जिसने मुझे माया-तृष्णा के भृमों से निकाल कर सद्मार्ग लगाया है।
P0072L31,यदि सतिगुरु अपनी कृपा-दृष्टि करे तो यह मनुष्य को अपनी संगति में मिला लेता है  ॥१४॥
P0072L32,हे भगवान ! तुम समस्त प्राणियों के भीतर समाए हुए हो।
P0072L33,ईश्वर ने अपनी ज्योति गुप्त रूप में मनुष्य के हृदय में रखी हुई है।
P0072L34,"हे नानक ! जिस मनुष्य के ह्रदय में ईश्वर ने अपनी ज्योति रखी हुई हैं, ईश्वर गुरु के माध्यम से उस मनुष्य के हृदय में प्रगट हो जाता है। ॥१५॥"
P0072L35,हे ईश्वर ! तुमने ही तन की मूर्ति गढ़कर
P0072L36,उसमें प्राणों का संचार करके मुझे पैदा किया है।
P0072L37,अपने दोनों हाथ उसके मस्तक पर रखकर प्रभु अपने सेवक की प्रतिष्ठा बरकरार रखता है ॥१६॥
P0072L38,समूह अटकलें और चतुराईयाँ किसी काम नहीं आती।
P0072L39,मेरा प्रभु सब कुछ जानता है।
P0072L40,ईश्वर ने मेरा प्रताप सब ओर प्रकट किया है और सब मेरी जय-जयकार करने लगे हैं ॥१७॥
P0072L41,"परमात्मा ने मेरे गुणों-अवगुणों पर ध्यान नहीं दिया,"
P0072L42,उसने तो केवल अपने विरद की लाज निभाई है।
P0072L43,ईश्वर ने अपने गले लगा कर मेरी रक्षा की है और मुझे गर्म हवा भी नहीं छूती ॥१८॥
P0072L44,अपने तन-मन से मैंने प्रभु की स्तुति की है।
P0072L45,इसलिए मुझे मनोवांछित फल प्राप्त हुआ है।
P0072L46,"हे ईश्वर ! तुम सम्राटों के भी सम्राट हो, इसलिए हे नानक ! मैं तुम्हारे ही नाम-सिमरन से जीवन धारण करता हूँ  ॥१९॥"
P0073L01,हे भगवान ! तुमने स्वयं ही सृष्टि की रचना की है
P0073L02,और जगत् रूपी खेल को साज कर प्रत्यक्ष किया है।
P0073L03,"समस्त स्थानों पर सत्य प्रभु के सत्य हुक्म का प्रसार हो रहा है, किन्तु उसके मूल रहस्य को वही समझता है जिसे तुम समझाते हो ॥२०॥"
P0073L04,"गुरु की कृपा से जिसने भगवान को पा लिया है,"
P0073L05,भगवान ने उसका माया का मोह नष्ट कर दिया है।
P0073L06,अपनी कृपा करके वह स्वयं अपने साथ मिला लेता है ॥ २१॥
P0073L07,"हे प्रभु ! तुम ही गोपी हो, तुम ही यमुना हो,"
P0073L08,तुम ही कृष्ण हो। तूने ही कृष्ण रूप में गोवर्धन पर्वत अपनी उंगली पर उठाया था।
P0073L09,तूने ही अपने हृदय में जीवों के शरीर रूपी बर्तन निर्मित किए हैं। तुम स्वयं ही इन शरीर रूपी बर्तनों को नष्ट करते एवं निर्माण करते हो ॥२२॥
P0073L10,"जिन्होंने अपना चित सतिगुरु से लगाया है,"
P0073L11,उन्होंने माया का मोह दूर कर दिया है।
P0073L12,ऐसे प्राणियों की ज्योति निर्मल हो जाती है। वह अपने जीवन को संवार कर परलोक में जाते हैं। ॥२३॥
P0073L13,हे भगवान ! तुम हमेशा ही मुझ पर उपकार करते रहते हो।
P0073L14,मुझ पर कृपा करो चूंकि मैं दिन-रात तेरी महिमा करता रहूँ।
P0073L15,तू इतना दयालु है कि बिना मांगे ही जीवों को दान देता रहता है। हे नानक ! हमेशा ही भगवान का सिमरन करते रहूँ ॥२४॥१॥
P0073L16,श्रीरागु महला ५ ॥
P0073L17,"मैं सतिगुरु के चरणों में पड़कर मन्नत करता हैं,"
P0073L18,क्योंकि महापुरुष सतिगुरु ने मुझे उस ईश्वर से मिला दिया है। उस जैसा महान् जगत् में अन्य कोई भी नहीं ॥१॥ रहाउ॥
P0073L19,मेरा मालिक प्रभु मुझे बहुत प्रिय है।
P0073L20,वह माता और पिता से बहुत मीठा लगता है।
P0073L21,"हे प्रभु ! बहन-भाई, मित्रादि स्वजनों में तुम्हारे जैसा अन्य कोई नहीं॥१ll"
P0073L22,तुम्हारे आदेश से श्रावण का महीना आया है।
P0073L23,तुम्हारी प्रसन्नता हेतु मैंने सत्य का हल जोड़ा है।
P0073L24,"इस आशा में कि ईश्वर, अपनी कृपा से दातों का अम्बार उत्पन्न करेगा, मैं नाम बीज बोने लगा हूँ॥२॥"
P0073L25,हे ईश्वर ! गुरु से मिलन के कारण मैं केवल तुम्हें ही पहचानता हूँ।
P0073L26,मैं अपने मन के अन्दर किसी अन्य हिसाब को नहीं जानता हूँ।
P0073L27,"ईश्वर ने एक कार्य मेरी जिम्मेदारी में लगाया है, जिस तरह उसको अच्छा लगता है, उसी तरह मैं उसको सम्पन्न करता हूँ॥३॥"
P0073L28,हे मेरे भाईयो ! आप नाम पदार्थ सेवन करो एवं आनंद मानो।
P0073L29,परमेश्वर के दरबार में गुरदेव ने मुझे भक्ति रूपी पोशाक भेंटकर प्रतिष्ठा प्रदान की है।
P0073L30,"मैं शरीर रूपी गांव का स्वामी हो गया हूँ और काम, क्रोध, लोभ, मोह, अहंकार इत्यादि अपने पांचों शरीकों को मैंने बांध लिया है॥४॥"
P0073L31,हे प्रभु ! जब से मैंने तेरी शरण ली है।
P0073L32,तब से मेरी पांचों ज्ञानेन्द्रियाँ मेरे सेवकों की भाँति मेरी आज्ञा में रहती हैं।
P0073L33,मेरे खिलाफ अब कोई कान (सिर) उठाने का साहस नहीं कर सकता। हे नानक ! इसलिए शरीर रूपी गांव आध्यात्मिक सम्पदा की सघन्ता से बस गया है॥५॥
P0073L34,"हे मेरे प्रभु! मैं तुझ पर बलिहार हूँ, कुर्बान हूँ,"
P0073L35,श्वास-श्वास मैं तुम्हारा ही नाम जपता हूँ।
P0073L36,"मेरा मन ऊजड़-गांव (गुण-रहित) की भाँति था, तुमने उसे बसा दिया है, इसलिए मैं तुझ पर बलिहार जाता हूँ॥६॥"
P0073L37,हे मेरे प्रियतम प्रभु ! तेरा मैं सदैव ही सिमरन करता हूँ
P0073L38,और जैसी मेरी अभिलाषा थी मेरी वह कामना पूरी हो गई है।
P0073L39,तुमने मेरे समस्त कार्य संवार दिए हैं और मेरी आत्मा की भूख निवृत्त कर दी है॥७॥
P0073L40,मैंने संसार के मिथ्या कार्य त्याग दिए हैं।
P0073L41,मैं सृष्टि के स्वामी की आराधना करता हूँ।
P0073L42,"नवनिधि को देने में समर्थ कल्पवृक्ष-समान हरिनाम मुझे मिला है, जिसे बड़े यत्न से मैंने अन्तर्मन में संजोया हुआ है।॥८॥"
P0073L43,मैं बहुत सुखी हूँ चूंकि मैंने सुख प्राप्त कर लिया है।
P0073L44,गुरु ने मेरे हृदय में भगवान का नाम बसा दिया है।
P0073L45,सतिगुरु ने मेरे माथे पर हाथ रखकर अर्थात् आशीर्वाद देकर मुझे भगवान के साक्षात् दर्शन करवा दिए हैं॥९ ॥
P0073L46,मैंने सच्चाई के मन्दिर की धर्मशाला बनाई है।
P0073L47,गुरु के शिष्यों को ढूंढ कर मैं यहाँ पर लेकर आया हूँ।
P0073L48,"मैं उनके चरण धोता हूँ, पंखा झुलाता और विनम्रतापूर्वक झुक-झुककर उनके चरण स्पर्श करता हूं॥१०॥"
P0074L01,गुरु के शिष्यों से बातें सुनकर मैं गुरु के पास आया हूँ।
P0074L02,"गुरु ने मुझे नाम, दान-पुण्य और स्नान निश्चित करवा दिया है।"
P0074L03,हे नानक ! नाम रूपी सच्ची नाव पर सवार होने के कारण सारा संसार बच गया है। ११॥
P0074L04,हे प्रभु ! सारी सृष्टि दिन-रात तेरी सेवा का फल पाती है।
P0074L05,हे स्वामी ! अपना कान देकर मेरी प्रार्थना सुनो।
P0074L06,मैंने सभी को भलीभांति निर्णय करके देख लिया है। केवल तुम ही अपनी प्रसन्नता द्वारा प्राणियों को मोक्ष प्रदान करते हो ॥१२॥
P0074L07,अब मेहरबान परमात्मा का आदेश जारी हो गया है।
P0074L08,कोई भी किसी को दुखी नहीं करता।
P0074L09,सारी दुनिया सुखपूर्वक रहती है। क्योंकि अब यहाँ सात्विक का राज्य स्थापित हो गया है॥१३॥
P0074L10,सतिगुरु मेघ की भाँति अमृत बरसा रहे हैं।
P0074L11,"मैं उस तरह बोलता हूँ, जिस तरह भगवान मुझे बुलाता है।"
P0074L12,हे दाता ! मुझे तुम पर बड़ा गर्व है। | तुम स्वयं ही मेरे कर्मों को निर्दिष्ट कर सफल बनाते हो॥१४॥
P0074L13,हे प्रभु ! तुम्हारे भक्तों को सदा तुम्हारे दर्शनों की लालसा है।
P0074L14,हे प्रभु! मेरी मनोवांछित कामनाओं को सफल करो।
P0074L15,हे सुखदाता ! मुझे अपने दर्शन देकर अपने गले से लगा लो॥१५॥
P0074L16,तेरे जैसा महान् मुझे अन्य कोई नहीं मिला।
P0074L17,"तुम धरती, आकाश व पाताल में व्यापक हो।"
P0074L18,सातों द्वीपों और पाताल लोकों में तुम्हारा ही आलोक प्रसारित है। हे नानक ! भक्तों को परमात्मा का ही सहारा है॥१६॥
P0074L19,मैं अपने मालिक प्रभु का एक छोटा-सा पहलवान हूँ।
P0074L20,गुरु से मिलकर मैंने ऊँची दस्तार सजा ली है।
P0074L21,मेरी कुश्ती देखने के लिए तमाशा देखने वालों की भीड़ एकत्र हो गई है और दयालु परमात्मा स्वयं बैठ कर देख रहा है॥१७॥
P0074L22,"अखाड़े में वाजे, नगाड़े और तूतीयाँ बज रहे हैं।"
